merk,price,location,buy
Sepatu Vans Slip On Mono OG Checkerboard Black White PREMIUM BNIB,110.000,KOTA JAKARTA SELATAN,10RB+ Terjual
BISA COD - SEPATU SNEAKERS CONVERSE ALLSTAR BOOTS (TINGGI) PRIA DAN WANITA CASUAL GRADE ORI (HIGH)+ BOX,55.900,KAB. BANDUNG,4RB Terjual
GROSIRTAS TG1589 Sneakers Kanvas Bear Import / Sepatu Terbaru (include Box),81.200,KOTA JAKARTA BARAT,282 Terjual
DEDRICK |ManNeedMe x NAZ| Sepatu Sneakers Pria Casual ORIGINAL,118.750,KAB. BANDUNG,10RB+ Terjual
Sepatu Sneakers Hugov Edition Pria - 212 - Yellow,228.000,KAB. TANGERANG,"2,7RB Terjual"
2022 baru sepatu impor wanita  rajut  premium bernapas olahraga bebas biaya kirim  Batavia Shoes Fashion Sneaker  Pink Hitam Grey Onlinemall kanvas P1/P2/P11,65.000,KOTA JAKARTA BARAT,10RB+ Terjual
DL - SEPATU CASUAL VAN OLD SCHOOL TERMURAH,26.000,KAB. BOGOR,"7,7RB Terjual"
Sepatu Sneakers 70s Egret High BNIB,147.000,KAB. TANGERANG,10RB+ Terjual
"Dr. Kevin Sepatu Sport Pria Men Sneakers 889-022 - Abu, Coffe & Hitam (3 Warna)",114.980,KOTA BEKASI,10RB+ Terjual
Sepatu casual Vns blue denim Special edition VD2,27.900,KAB. BOGOR,10RB+ Terjual
DFC SEPATU BOOTS WANITA HIGH HEELS - Boots & Ankle Boots Hak,38.400,KAB. BOGOR,"9,9RB Terjual"
PVN Kara Sepatu Sneakers Tali Casual Wanita Sport Shoes Black 372,149.999,KOTA JAKARTA PUSAT,10RB+ Terjual
Globalmarket.id Sepatu Sneakers Fashion Wanita Korea Import [TANPA DUS] - SHG024,109.900,KAB. TANGERANG,10RB+ Terjual
Geoff Max Official - Ethan Navy White | Sepatu Pria | Sepatu Wanita | Sepatu Unisex,250.000,KAB. BANDUNG,10RB+ Terjual
RK Collection - Sp-03 Sepatu Fashion imprt LC10,35.000,KAB. BOGOR,10RB+ Terjual
Sepatu Pria Sneakers Sport / Sepatu Running Pria / Sepatu Sporty Pria,36.600,KAB. BOGOR,10RB+ Terjual
Leedoo Sepatu Pria Casual Sneaker Running Sport Shoes MR112,99.000,KOTA TANGERANG,10RB+ Terjual
3.3 FASHION SALE ☞!! Sepatu Kets Wanita Terbaru FASHIONE NEW Termurah,37.700,KAB. BOGOR,10RB+ Terjual
( READY ) SEPATU CONVERS CLASSIC PENDEK HITAM | MADE IN VIETNAM I SEPATU PRIA DAN WANITA I 70'S LOW I SEPATU CASUAL,75.000,KAB. BEKASI,10RB+ Terjual
"MKT , SEPATU SNEAKERS WANITA / PEREMPUAN KASUAL TRENDY FASHION NYAMAN SW01-7034",39.600,,"5,1RB Terjual"
Ennwen SH11 Sepatu Kanvas Wanita Korea Style Warna Warni Women Canvas Shoes,59.900,KOTA JAKARTA BARAT,"6,2RB Terjual"
OBRAL SEPATU SNEAKERS 70S X OFF WHITE GLOSSY HIGH BLACK WHITE 38-43,110.000,KOTA JAKARTA SELATAN,10RB+ Terjual
TERLARIS SEPATU SNEAKERS KASUAL Adidas Spezial / Munchen / Samba / Hamburg MURAH Bayar Di Tempat,130.000,KOTA SURAKARTA (SOLO),10RB+ Terjual
Polla Polly - Sneakers JISOO White - Sepatu Sport Wanita Model Korea,153.700,KOTA JAKARTA PUSAT,"8,5RB Terjual"
Sepatu Sneakers Pria Wanita Logo Timbul Emboss - Sepatu Korea Fashion Import Sport Shoes Casual sekolah,25.000,KAB. SIDOARJO,10RB+ Terjual
Panarybody Sneakers Sepatu Pria Sepatu Olahraga Laki-lai Impor Sepatu Brand Sneakers Cowok 39-44,119.000,KOTA SURABAYA,10RB+ Terjual
(2PCS = 1KG) COD SEPATU PRIA CASUAL CNVRS VERSE LOW CLASSIC MAROON HITAM NAVY ABU PUTIH KUNING,44.900,KOTA SURABAYA,10RB+ Terjual
Sepatu Import Sepatu Sneakers Wanita Casual Wear ala Import Shoes Sneakers Keren SP-098,93.100,,10RB+ Terjual
"Promo sepatu sneakers allstar convers017 Petir cocok buat main, sekolah, kuliah, jalan jalan sedia u",49.000,KAB. TANGERANG,10RB+ Terjual
PROMO RAMADHAN COD [ Bayar ditempat ] R88 Sepatu Canvas Wanita Import High Quality,67.219,KAB. TANGERANG,10RB+ Terjual
LUXUS Momo Sepatu Sneakers Import Fashion Wanita Korea - Lx2012,87.499,KOTA TANGERANG,10RB+ Terjual
Sepatu Olahraga Wanita/ Pria  nik  Sport Running Casual Jalan Belanja Kerja Empuk Lari Senam,38.250,KAB. MOJOKERTO,"7,4RB Terjual"
Athletica Official Shop - AT 693 Black White Shoes| Sepatu Running | Sepatu Pria | Sneakers,262.500,KAB. BANDUNG,10RB+ Terjual
ENNWEN SH61 Sepatu Wanita Nylon Sneakers FAshion Flower Sport Import,38.900,KOTA JAKARTA BARAT,"5,1RB Terjual"
( READY ) SEPATU CNVRS CLASSIC TINGGI HITAM | MADE IN VIETNAM I SEPATU PRIA DAN WANITA I 70'S HIGH I SEPATU CASUAL,75.000,KAB. BEKASI,10RB+ Terjual
KZT-SW301 Sepatu Sneakers Canvas Wanita Impor - Sepetu wanita Kanvas,69.300,KAB. TANGERANG,10RB+ Terjual
TERBARU Sepatu Sport Pria Sepatu Sneakers SUP Sepatu jogging pria wanita,35.260,KAB. BOGOR,10RB+ Terjual
( READY )SEPATU CONVERS CLASSIC x KAWS PENDEK | MADE IN VIETNAM I SEPATU PRIA DAN WANITA I SEPATU CASUAL,78.000,KAB. BEKASI,10RB+ Terjual
SEPATU NIKE ZOOM PRIA WANITA TERBARU HITAM PUTIH / SEPATU SNEAKERS IMPORT SEKOLAH DAN KERJA HITAM,90.100,KAB. SIDOARJO,10RB+ Terjual
"Dr. Kevin Sepatu Sport Pria Men Sneakers 889-025 - (2 Color Options) Coffee, Abu-Abu",114.980,,10RB+ Terjual
( READY ) SEPATU CONVERS PETIR PENDEK x UNDEFEATED LOW | IMPORT VIETNAM I SEPATU PRIA DAN WANITA I SEPATU CASUAL,78.400,KAB. BEKASI,10RB+ Terjual
MAN & LADIES SEPATU BASKET AIR JORDAN D*OR LOW DAN HIGH WANITA PRIA SNEAKERS BASKET,217.000,KAB. BANTUL,"4,2RB Terjual"
Blucrat Sepatu Pria Casual Sneaker Jiren,99.000,KOTA BANDUNG,10RB+ Terjual
( READY ) SEPATU CONVERS CLASSIC TINGGI HITAM | CONVERSE MADE IN VIETNAM I SEPATU PRIA DAN WANITA I 70'S HIGH I SEPATU CASUAL,75.000,KAB. BEKASI,10RB+ Terjual
SEPATU RUNNING PRIA AIR ZOOM ALPHAFLY NEXT% BLACK GREEN/WATERMELON ORANGE PREMIUM ORIGINAL,399.000,KOTA JAKARTA SELATAN,10RB+ Terjual
"Dr. Kevin Sepatu Sport Pria Men Sneakers 889-026 - Abu, Hitam & Coffee",114.980,KOTA BEKASI,10RB+ Terjual
SEPATU CONVERSE LOW CT II UNDEFEATED BLACK WHITE UNISEX 100% PREMIUM QUALITY SEPATU PRIA/WANITA SNEAKERS TERLARIS BEST SELLER BISA COD,123.000,KAB. BANDUNG,2RB Terjual
6.6 MID YEAR SALE LUMMYSHOP SEPATU WANITA SUGA BOOTS IMPORT PREMIUM,167.000,KOTA JAKARTA BARAT,"2,3RB Terjual"
R9 ZIPER Sepatu Boots Wanita Best Seller BOOT Wanita Korea,37.000,KAB. BOGOR,10RB+ Terjual
( BISA COD ) SEPATU CONVERS CLASSIC PENDEK | MADE IN VIETNAM I SEPATU PRIA DAN WANITA I 70'S LOW I SEPATU CASUAL,60.000,KAB. BEKASI,10RB+ Terjual
Sepatu Casual vans Pria Era Authentic hitam abu marun dan fullblack sekolah,50.000,KAB. BANDUNG,10RB+ Terjual
7.7 SALE SEPATU POXING (BEIER),30.900,KAB. BOGOR,10RB+ Terjual
Sepatu Basket BALLERBRO BB3,349.000,KOTA JAKARTA UTARA,"2,6RB Terjual"
"Big Sale Sepatu Kets Denim DC, Premium",29.900,KAB. BOGOR,10RB+ Terjual
Polla Polly - Dawn White - Sepatu Sneakers Sport Wanita Model Korea,162.700,KOTA JAKARTA PUSAT,"7,5RB Terjual"
sepatu pantofel pria.sepatu pantofel hitam.sepatu murah.sepatu pormal,98.945,KAB. BANDUNG,10 Terjual
Zenzy Vomella Shoes Korea Inspired - Sepatu Casual Comfy,270.000,KOTA JAKARTA BARAT,550 Terjual
PVN Taeyong Sepatu Sneakers Wanita Sport Shoes Cream 103,149.999,KOTA JAKARTA PUSAT,10RB+ Terjual
[ESSE] Import Sepatu Sneaker import running pria 006,88.000,KOTA TANGERANG,10RB+ Terjual
Sepatu Pria / Sepatu Olahraga / Dans Clothing Shoes,19.000,KAB. BOGOR,"2,2RB Terjual"
